<?xml version="1.0" encoding="UTF-8"?>
<!DOCTYPE Config SYSTEM "hector_config.dtd">
<!--
test5: two readers(1), one simple intermediates(1), one writer(1)
-->
<Config>
	<Server id="test" lib="TestServer.la">
		<threads>1</threads>
		<serverHost>*</serverHost>
		<serverPort>1101</serverPort>
		<logConfig><![CDATA[
			log4j.rootLogger=DEBUG, LOGFILE
			log4j.appender.LOGFILE=org.apache.log4j.FileAppender
			log4j.appender.LOGFILE.File=test.log
			log4j.appender.LOGFILE.Append=true
			log4j.appender.LOGFILE.Threshold=DEBUG
			log4j.appender.LOGFILE.layout=org.apache.log4j.PatternLayout
			log4j.appender.LOGFILE.layout.ConversionPattern=%m%n ]]>
		</logConfig>
		<resources>
			<Resource id="R_test" lib="TestResource.la"/>
		</resources>
		<ProcessingEngine id="PE_test">
			<Processor id="P_input1">
				<threads>1</threads>
				<modules>
					<Module id="M_input1" lib="TestInput.la">
						<param name="maxItems" value="1000"/>
						<param name="idPrefix" value="i1-"/>
					</Module>
				</modules>
				<output>
					<nextProcessor ref="P_simple"/>
				</output>
			</Processor>
			<Processor id="P_input2">
				<threads>1</threads>
				<modules>
					<Module id="M_input2" lib="TestInput.la">
						<param name="maxItems" value="2000"/>
						<param name="idPrefix" value="i2-"/>
					</Module>
				</modules>
				<output>
					<nextProcessor ref="P_simple"/>
				</output>
			</Processor>
			<Processor id="P_simple">
				<threads>5</threads>
				<modules>
					<Module id="M_simple" lib="TestSimple.la"/>
				</modules>
				<input>
					<queue/>
				</input>
				<output>
					<nextProcessor ref="P_output"/>
				</output>
			</Processor>
			<Processor id="P_output">
				<threads>1</threads>
				<modules>
					<Module id="M_output" lib="TestOutput.la"/>
				</modules>
				<input>
					<queue/>
				</input>
			</Processor>
		</ProcessingEngine>
	</Server>
</Config>
