<?xml version="1.0" encoding="UTF-8"?>
<!DOCTYPE Config SYSTEM "hector_config.dtd">
<!--
input_simple_output_mt_py: multithreaded intermediate (simple): reader(5), one simple intermediate(5), one writer(5)
-->
<Config>
	<Server id="test" lib="TestServer.la">
		<threads>1</threads>
		<serverHost>*</serverHost>
		<serverPort>1101</serverPort>
		<logConfig><![CDATA[
			log4j.rootLogger=DEBUG, LOGFILE
			log4j.appender.LOGFILE=org.apache.log4j.FileAppender
			log4j.appender.LOGFILE.File=input_simple_output_mt_py.log
			log4j.appender.LOGFILE.Append=false
			log4j.appender.LOGFILE.Threshold=DEBUG
			log4j.appender.LOGFILE.layout=org.apache.log4j.PatternLayout
			log4j.appender.LOGFILE.layout.ConversionPattern=%m%n ]]>
		</logConfig>
		<ProcessingEngine id="PE_test">
			<Processor id="P_input">
				<threads>5</threads>
				<modules>
					<Module id="M_input" type="python" lib="TestInput.py">
						<param name="maxItems" value="1000"/>
					</Module>
				</modules>
				<output>
					<nextProcessor ref="P_simple"/>
				</output>
			</Processor>
			<Processor id="P_simple">
				<threads>5</threads>
				<modules>
					<Module id="M_simple" type="python" lib="TestSimple.py"/>
				</modules>
				<input>
					<queue/>
				</input>
				<output>
					<nextProcessor ref="P_output"/>
				</output>
			</Processor>
			<Processor id="P_output">
				<threads>5</threads>
				<modules>
					<Module id="M_output" type="python" lib="TestOutput.py"/>
				</modules>
				<input>
					<queue/>
				</input>
			</Processor>
		</ProcessingEngine>
	</Server>
</Config>
