<?xml version="1.0" encoding="UTF-8"?>
<!DOCTYPE Config SYSTEM "hector_config.dtd">
<!--
test3: intermediate (simple): one reader(1), one simple intermediate(1), one writer(1)
-->
<Config>
	<Server id="test" lib="TestServer.la">
		<threads>1</threads>
		<serverHost>*</serverHost>
		<serverPort>1101</serverPort>
		<logConfig>test.log.props</logConfig>
		<resources>
			<Resource id="R_test" lib="TestResource.la"/>
		</resources>
		<ProcessingEngine id="PE_test">
			<Processor id="P_input">
				<threads>1</threads>
				<modules>
					<Module id="M_input" lib="TestInput.la">
						<param name="maxItems" value="1000"/>
					</Module>
				</modules>
				<output>
					<nextProcessor ref="P_simple"/>
				</output>
			</Processor>
			<Processor id="P_simple">
				<threads>1</threads>
				<modules>
					<Module id="M_simple" lib="TestSimple.la"/>
				</modules>
				<input>
					<queue/>
				</input>
				<output>
					<nextProcessor ref="P_output"/>
				</output>
			</Processor>
			<Processor id="P_output">
				<threads>1</threads>
				<modules>
					<Module id="M_output" lib="TestOutput.la"/>
				</modules>
				<input>
					<queue/>
				</input>
			</Processor>
		</ProcessingEngine>
	</Server>
</Config>
