<?xml version="1.0" encoding="UTF-8"?>
<!DOCTYPE Config SYSTEM "hector_config.dtd">
<!--
load_save: test of loading/saving module
-->
<Config>
	<Server id="test" lib="TestServer.la">
		<threads>1</threads>
		<serverHost>*</serverHost>
		<serverPort>1101</serverPort>
		<logConfig><![CDATA[
			log4j.rootLogger=DEBUG, LOGFILE
			log4j.appender.LOGFILE=org.apache.log4j.FileAppender
			log4j.appender.LOGFILE.File=load_save.log
			log4j.appender.LOGFILE.Append=false
			log4j.appender.LOGFILE.Threshold=DEBUG
			log4j.appender.LOGFILE.layout=org.apache.log4j.PatternLayout
			log4j.appender.LOGFILE.layout.ConversionPattern=%m%n ]]>
		</logConfig>
		<ProcessingEngine id="PE_test">
			<Processor id="P_load">
				<threads>1</threads>
				<modules>
					<Module id="M_load" lib="Load.la">
						<param name="filename" value="$1"/>
					</Module>
				</modules>
				<output>
					<nextProcessor ref="P_save"/>
				</output>
			</Processor>
			<Processor id="P_save">
				<threads>1</threads>
				<modules>
					<Module id="M_save" lib="Save.la">
						<param name="filename" value="$2"/>
						<param name="saveResourceType" value="true"/>
					</Module>
				</modules>
				<input>
					<queue/>
				</input>
			</Processor>
		</ProcessingEngine>
	</Server>
</Config>
