<?xml version="1.0" encoding="UTF-8"?>
<!DOCTYPE Config SYSTEM "hector_config.dtd">
<!--
test10: test of loading/saving module
-->
<Config>
	<Server id="test" lib="TestServer.la">
		<threads>1</threads>
		<serverHost>*</serverHost>
		<serverPort>1101</serverPort>
		<logConfig>test.log.props</logConfig>
		<resources>
			<Resource id="R_test" lib="TestResource.la"/>
		</resources>
		<ProcessingEngine id="PE_test">
			<Processor id="P_load">
				<threads>1</threads>
				<modules>
					<Module id="M_load" lib="Load.la">
						<param name="filename" value="test10.data.in"/>
					</Module>
				</modules>
				<output>
					<nextProcessor ref="P_save"/>
				</output>
			</Processor>
			<Processor id="P_save">
				<threads>1</threads>
				<modules>
					<Module id="M_save" lib="Save.la">
						<param name="filename" value="test10.data.out"/>
					</Module>
				</modules>
				<input>
					<queue/>
				</input>
			</Processor>
		</ProcessingEngine>
	</Server>
</Config>
