<?xml version="1.0" encoding="UTF-8"?>
<!DOCTYPE Config SYSTEM "hector_config.dtd">
<!--
input_multi_output: multiple module: one reader(1), one multi intermediate(1), one writer(1)
-->
<Config>
	<Server id="test" lib="TestServer.la">
		<threads>1</threads>
		<serverHost>*</serverHost>
		<serverPort>1101</serverPort>
		<logConfig><![CDATA[
			log4j.rootLogger=DEBUG, LOGFILE
			log4j.appender.LOGFILE=org.apache.log4j.FileAppender
			log4j.appender.LOGFILE.File=input_multi_output.log
			log4j.appender.LOGFILE.Append=false
			log4j.appender.LOGFILE.Threshold=DEBUG
			log4j.appender.LOGFILE.layout=org.apache.log4j.PatternLayout
			log4j.appender.LOGFILE.layout.ConversionPattern=%m%n ]]>
		</logConfig>
		<ProcessingEngine id="PE_test">
			<Processor id="P_input">
				<threads>1</threads>
				<modules>
					<Module id="M_input" lib="TestInput.la">
						<param name="maxItems" value="100"/>
					</Module>
				</modules>
				<output>
					<nextProcessor ref="P_multi"/>
				</output>
			</Processor>
			<Processor id="P_multi">
				<threads>1</threads>
				<modules>
					<Module id="M_dump1" lib="Dump.la"/>
					<Module id="M_multi1" lib="TestMulti.la">
						<param name="timeTick" value="100"/>
					</Module>
					<Module id="m_dump2" lib="Dump.la"/>
					<Module id="M_multi2" lib="TestMulti.la">
						<param name="timeTick" value="100"/>
					</Module>
					<Module id="M_dump3" lib="Dump.la"/>
				</modules>
				<input>
					<queue/>
				</input>
				<output>
					<nextProcessor ref="P_output"/>
				</output>
			</Processor>
			<Processor id="P_output">
				<threads>1</threads>
				<modules>
					<Module id="M_dump4" lib="Dump.la"/>
					<Module id="M_output" lib="TestOutput.la"/>
				</modules>
				<input>
					<queue/>
				</input>
			</Processor>
		</ProcessingEngine>
	</Server>
</Config>
